{
  "format_version": 1,
  "name": "sumeru-long-low-observability",
  "kpis": {
    "max_false_locks": 0,
    "max_wrong_layer_positions": 0,
    "min_tracking_coverage": 0.95,
    "max_untracked_streak_seconds": 2.0,
    "max_reacquire_p95_seconds": 3.0,
    "max_one_frame_layer_runs": 0,
    "max_stationary_jitter_p95_px": 5.0,
    "min_position_checkpoints": 2
  },
  "scenarios": [
    {
      "name": "five-minute Sumeru route through sparse ruins",
      "path": "../datasets/local/scenarios/sumeru_long_validation",
      "gating": true,
      "classification": "low_observability",
      "waive_failures": [
        "tracking_coverage",
        "reacquire_p95_seconds"
      ],
      "rationale": "A genuine 4x AppSample detail reference improved the isolated ruins baseline by less than one percentage point. Availability limitations are accepted for this visual domain; false locks, wrong layers, long unavailable streaks, and unstable accepted positions remain hard failures."
    }
  ]
}
